Date,title,desc
2019-12-04,"Cave diver tells court Elon Musk tweets 'humiliated' himElon Musk apparently doesn't know how much he's worth - CNETElon Musk Said He Is Worth $20 Billion During 2nd Day of Testimony in 'Pedo Guy' Defamation TrialElon Musk said in a leaked email to Tesla employees that delivering cars and installing solar roofs are his top priorities for the end of the year (TSLA)Potential jurors in Elon Musk's defamation trial were dismissed because they follow him on TwitterIn the hours around his 'pedo guuy' court appearance, Elon Musk tweeted about the Cybertruck, the make up of the atmosphere, and an upcoming SpaceX launchTesla Semi, meet the Nikola Tre -- ready for production next year - RoadshowMusk takes stand in 'pedo guy' court case - BBC NewsElon Musk reportedly wanted to buy 'justballs.com' because of courseElon Musk opens up about his wealth during second day of testimony in 'pedo guy' defamation trial","Vernon Unsworth tells a court that he felt ""ashamed"" after the Tesla founder dubbed him ""pedo guy"".The Tesla and SpaceX CEO was reportedly asked about his net worth and said he does not have a lot of cash.The Tesla CEO took the witness stand in a Los Angeles courtroom Wednesday in a trial centered on public discourse on social media.Fulfilling customer orders and installing more solar products are Tesla CEO Elon Musk 's two biggest priorities for the electric-car maker for the end of this year, Musk said Wednesday in an internal email obtained by Business Insider. ""The first is making su…Elon Musk is currently on trial for alleged defamation against cave diver Vernon Unsworth. Musk called Unsworth ""pedo guy"" on Twitter after the diver criticized Musk's proposal to use a tiny submarine to rescue a Thai soccer team trapped in a flooded cave sys…Reuters Elon Musk's Twitter appears to be business as usual on the day he made a court appearance during a defamation case against him brought by Vernon Unsworth, who Musk called a ""pedo guy"" on Twitter. Musk tweeted about the Cybertruck, hydrogen gas becomin…The Nikola Tre is going to production, thanks to a partnership with CNH Industrial.Musk takes stand in 'pedo guy' court case BBC News Defamation trial against Tesla CEO Elon Musk begins Fox Business Musk takes the stand in first day of “pedo guy” trial Ars Technica Elon Musk Apologizes For ‘Pedo’ Comments In Twitter Dispute With Thailand Ca…Just balls, and only the balls. Eccentric billionaire and owner of stankmemes.com Elon Musk has plenty of appropriately oddball passions. His love of flamethrowers and snails is well known, for example. However, it was only today that his interest in ball-rel…The Tesla CEO took the witness stand in a Los Angeles courtroom Wednesday in a trial that could set a precedent for public discourse on social media."
2019-12-05,Elon Musk wins 'pedo guy' defamation caseElon Musk: Diver seeks $190m in damages over 'pedo guy' tweetCave diver tells court Elon Musk tweets 'humiliated' himThis Lego Cybertruck is one even Elon can loveElon Musk found not liable in case brought against him by British diverElon Musk not liable in 'pedo guy' trialTesla expects to release the most and least expensive versions of the Cybertruck a year earlier than expected (TSLA)Elon Musk apparently doesn't know how much he's worth - CNETJurors expected to begin deliberating in Elon Musk defamation trialElon Musk Said He Is Worth $20 Billion During 2nd Day of Testimony in 'Pedo Guy' Defamation Trial,"The Tesla founder did not defame a UK diver who helped in a Thai cave rescue, a US jury finds.The Tesla co-founder tweeted his 22 million followers calling diver Vernon Unsworth a ""pedo guy"".Vernon Unsworth tells a court that he felt ""ashamed"" after the Tesla founder dubbed him ""pedo guy"".Lego already debuted its own take on the divisive Tesla Cybertruck design, but theirs was purely for the lols. This Lego Cybertruck, however, submitted to the official Lego Ideas crowdsourcing website, is actually a remarkably faithful representation, and com…After a three-day trial, Elon Musk was found not liable for defamation in a federal court today in Los Angeles, where Musk reportedly owns a cluster of six homes as well as oversees the operations of both SpaceX and, to some extent, Tesla, which is headquarte…Read more... {""player"":{""description"":null,""image"":""https://mondrian.mashable.com/cms%252F2019%252F12%252Fd2277150-5066-7119%252Fthumb%252F00001.jpg%252F930x520.jpg?signature=oN-5jC9jmyv0766NP3TVrLIILpc=&source=https%3A%2F%2Fvdist.aws.mashable.com"",""mediaid"":…Tesla has changed the production timelines for the most and least expensive trims of its Cybertruck pickup truck. Production for the three-motor, all-wheel-drive Cybertruck, which starts at $69,900, will begin in 2021, a year earlier than Tesla first announce…The Tesla and SpaceX CEO was reportedly asked about his net worth and said he does not have a lot of cash.Jurors were expected to begin deliberating in Los Angeles on Friday in the lawsuit brought against Elon Musk by a British cave explorer who says the Tesla founder defamed him with tweets suggesting he is a pedophile.The Tesla CEO took the witness stand in a Los Angeles courtroom Wednesday in a trial centered on public discourse on social media."
2019-12-06,Elon Musk Wins in Defamation Suit by British DiverElon Musk wins 'pedo guy' defamation caseElon Musk: Diver seeks $190m in damages over 'pedo guy' tweetThis Lego Cybertruck is one even Elon can loveElon Musk found not liable in case brought against him by British diverElon Musk not liable in 'pedo guy' trialTesla Cybertruck in LEGOTesla expects to release the most and least expensive versions of the Cybertruck a year earlier than expected (TSLA)Jurors expected to begin deliberating in Elon Musk defamation trialLos Angeles Jury Finds No Defamation In Elon Musk's 'Pedo Guy' Tweet,"The verdict in favor of the Tesla CEO capped a four-day trial in Los Angeles over insults Musk tweeted in 2018.The Tesla founder did not defame a UK diver who helped in a Thai cave rescue, a US jury finds.The Tesla co-founder tweeted his 22 million followers calling diver Vernon Unsworth a ""pedo guy"".Lego already debuted its own take on the divisive Tesla Cybertruck design, but theirs was purely for the lols. This Lego Cybertruck, however, submitted to the official Lego Ideas crowdsourcing website, is actually a remarkably faithful representation, and com…After a three-day trial, Elon Musk was found not liable for defamation in a federal court today in Los Angeles, where Musk reportedly owns a cluster of six homes as well as oversees the operations of both SpaceX and, to some extent, Tesla, which is headquarte…Read more... {""player"":{""description"":null,""image"":""https://mondrian.mashable.com/cms%252F2019%252F12%252Fd2277150-5066-7119%252Fthumb%252F00001.jpg%252F930x520.jpg?signature=oN-5jC9jmyv0766NP3TVrLIILpc=&source=https%3A%2F%2Fvdist.aws.mashable.com"",""mediaid"":…BrickinNick created this LEGO model of the new Tesla Cybertruck. BrickinNick posted it to the LEGO Ideas site. If enough people like the design, it could become an actual LEGO product. From the LEGO Ideas specs : While its design may not be for everyone, many…Tesla has changed the production timelines for the most and least expensive trims of its Cybertruck pickup truck. Production for the three-motor, all-wheel-drive Cybertruck, which starts at $69,900, will begin in 2021, a year earlier than Tesla first announce…Jurors were expected to begin deliberating in Los Angeles on Friday in the lawsuit brought against Elon Musk by a British cave explorer who says the Tesla founder defamed him with tweets suggesting he is a pedophile.The Tesla CEO was embroiled in a Twitter spat with one of the rescuers of 12 boys and their soccer coach in Thailand last year."
2019-12-07,"Elon Musk Wins in Defamation Suit by British DiverTesla Cybertruck in LEGOLos Angeles Jury Finds No Defamation In Elon Musk's 'Pedo Guy' TweetTesla Wants To Clean Windshields With Laser BeamsThe internet celebrates Elon Musk's trial win by calling him 'pedo guy'Gurgel Itaipu (  1975) & Tesla Cybertruck (  2019)2019 BMW 330i, Volkswagen Atlas and more: Roadshow's week in review - RoadshowJury Sides With Elon Musk, Rejects $190M Defamation Claim Over TweetThe Margin: Self-driving Tesla slams into a cop car — and the driver blames his dogCybertruck Prototype Spotted Outside Tesla Store","The verdict in favor of the Tesla CEO capped a four-day trial in Los Angeles over insults Musk tweeted in 2018.BrickinNick created this LEGO model of the new Tesla Cybertruck. BrickinNick posted it to the LEGO Ideas site. If enough people like the design, it could become an actual LEGO product. From the LEGO Ideas specs : While its design may not be for everyone, many…The Tesla CEO was embroiled in a Twitter spat with one of the rescuers of 12 boys and their soccer coach in Thailand last year.Tesla ""may be keen on replacing the humble windshield wiper with lasers,"" reports CNET. In a patent application filed this past May and published with the United States Patent and Trademark Office on Nov. 21, Tesla describes a ""pulsed laser cleaning"" for ""deb…Elon Musk, ""pedo guy."" While the CEO of Tesla, SpaceX, and the Boring Company has decidedly not been accused of anything that would merit the rather distasteful moniker, Musk did just win a defamation trial about his calling someone else a ""pedo guy"" on Twitt…“Gurgel #Itaipu ( 1975) &amp; Tesla #Cybertruck ( 2019) - (both are electric cars)”Here's a look at our most important stories for the week ending Dec. 7.Aighearach (Slashdot reader #97,333) shared this story from Reuters: Tesla Inc boss Elon Musk emerged victorious on Friday from a closely watched defamation trial as a federal court jury swiftly rejected the $190 million claim brought against him by a British…A Tesla Model 3 on auto-pilot early Saturday morning crashed into two vehicles — one of them belonged to the Connecticut State Police. The driver explained that he was checking on his dog in the backseat.What appears to be a Cybertruck prototype was spotted outside of a Tesla store and posted to Reddit yesterday. The roughness seems to indicate an early prototype, or perhaps a testing mule of some sort."
2019-12-08,"By Miles, the UK pay-by-mile car insurance app, adds ‘connected car’ policy for Tesla driversElon Musk Hits Traffic Pylon With New Cybertruck After Dinner in MalibuVideo of Cybertruck driving on California highway reveals more questionsCadillac will help you shop for cars in a live virtual showroomElon Musk talks Tesla ATV, Cybertruck connection and electric dirt bikes - RoadshowTesla Wants To Clean Windshields With Laser BeamsThese are 2019's most bizarre concept carsJaguar increases I-Pace range with update after one-make race seriesElon Musk drove the controversial Tesla Cybertruck near Los Angeles 2 years before its planned releaseJaguar is boosting its EV range with a software update","By Miles, the U.K. pay-by-mile car insurance provider, is launching a “connected car” insurance policy specifically for Tesla drivers. The new insurance product pulls real-time mileage information directly from a car owner’s Tesla account and uses the distanc…Billionaire tech icon Elon Musk turned a lot of heads in Malibu, California on Saturday night when he showed up to a swanky restaurant in his new Tesla Cybertruck. But Musk’s night on the town included at least one embarrassing hiccup. The founder of Tesla an…Video of Cybertruck driving on California highway reveals more questions A video just surfaced showing the Tesla Cybertruck driving around LA. Elon Musk is purportedly driving, but it’s not confirmed that he was behind the wheel while this video was filmed. H…Cadillac is moving some of the car shopping process online... if not necessarily the parts you'd want the most. The automaker has launched a Cadillac Live service that lets you check out car features and ask questions through a live video connection to a show…The Tesla CEO spilled some interesting information on the ATV in a couple of tweets.Tesla ""may be keen on replacing the humble windshield wiper with lasers,"" reports CNET. In a patent application filed this past May and published with the United States Patent and Trademark Office on Nov. 21, Tesla describes a ""pulsed laser cleaning"" for ""deb…The streets would be so much more interesting if concept car designs overflowing with far-fetched ideas, jutting angles, and disconcerting shapes made it into the everyday vehicles riding on our roads. Alas, back in reality all we get are endless Priuses crow…Range increases by up to 12 miles, among other improvements.Photos and videos from TMZ show Tesla CEO Elon Musk in the electric-car maker's Cybertruck at the restaurant Nobu in Malibu.This story was delivered to Business Insider Intelligence Transportation & Logistics Briefing subscribers earlier this morning. To check to see if you already have access to Business Insider Intelligence through your company, click here. Jaguar told I-Pace el…"
2019-12-09,"By Miles, the UK pay-by-mile car insurance app, adds ‘connected car’ policy for Tesla driversElon Musk Hits Traffic Pylon With New Cybertruck After Dinner in MalibuVideo of Cybertruck driving on California highway reveals more questionsCadillac will help you shop for cars in a live virtual showroomTesla Cybertruck's Impressive Acceleration Caught On Video - InsideEVsElon Musk talks Tesla ATV, Cybertruck connection and electric dirt bikes - RoadshowThese are 2019's most bizarre concept carsJaguar increases I-Pace range with update after one-make race seriesElon Musk drove the controversial Tesla Cybertruck near Los Angeles 2 years before its planned releaseJaguar is boosting its EV range with a software update","By Miles, the U.K. pay-by-mile car insurance provider, is launching a “connected car” insurance policy specifically for Tesla drivers. The new insurance product pulls real-time mileage information directly from a car owner’s Tesla account and uses the distanc…Billionaire tech icon Elon Musk turned a lot of heads in Malibu, California on Saturday night when he showed up to a swanky restaurant in his new Tesla Cybertruck. But Musk’s night on the town included at least one embarrassing hiccup. The founder of Tesla an…Video of Cybertruck driving on California highway reveals more questions A video just surfaced showing the Tesla Cybertruck driving around LA. Elon Musk is purportedly driving, but it’s not confirmed that he was behind the wheel while this video was filmed. H…Cadillac is moving some of the car shopping process online... if not necessarily the parts you'd want the most. The automaker has launched a Cadillac Live service that lets you check out car features and ask questions through a live video connection to a show…Tesla Cybertruck's Impressive Acceleration Caught On Video InsideEVs Watch Tesla Cybertruck prototype accelerate like a sports car in new sighting Electrek Tesla (TSLA) shows strength amid impending Made-in-China Model 3 deliveries, Cybertruck sightings Tesla…The Tesla CEO spilled some interesting information on the ATV in a couple of tweets.The streets would be so much more interesting if concept car designs overflowing with far-fetched ideas, jutting angles, and disconcerting shapes made it into the everyday vehicles riding on our roads. Alas, back in reality all we get are endless Priuses crow…Range increases by up to 12 miles, among other improvements.Photos and videos from TMZ show Tesla CEO Elon Musk in the electric-car maker's Cybertruck at the restaurant Nobu in Malibu.This story was delivered to Business Insider Intelligence Transportation & Logistics Briefing subscribers earlier this morning. To check to see if you already have access to Business Insider Intelligence through your company, click here. Jaguar told I-Pace el…"
2019-12-10,"EPA says the Porsche Taycan Turbo will get just 201 miles on a full batteryPorsche Taycan already has 30,000 pre-orders. How does that compare to Tesla?Tesla Cybertruck's Impressive Acceleration Caught On Video - InsideEVsElon Musk's mother unearthed a 1995 photo of him fixing a car window, and he joked he's come 'full circle' with CybertruckTesla wants to produce 500,000 cars per year at German plantPlus.ai's autonomous lorry 'crosses US in three days'Elon Musk won his 'pedo guy' defamation case. Here are all the bizarre spats the the Tesla CEO is caught up in thanks to his Twitter habit.Tesla Model 3 named ‘best electric car’ by EdmundsFord Dealership: You Can't Charge the Mustang Mach E at HomeApple: Only clean the Pro Display XDR nano-texture screen with our polishing cloth - CNET","It’s a much more conservative estimate than the 280 miles Porsche had previously promoted with the Taycan Turbo. And while it’s maybe a little too conservative of an estimate, it’s not going to help Porsche position its first EV against competition like Tesla.The year is 2012. Elon Musk has yet to call anyone a "" pedo guy "" or drag the SEC on Twitter. There's no Cybertruck with cracked windows, and no overly ambitious promises of a $35,000 electric car. Instead, fledgling electric vehicle company Tesla is just sta…Tesla Cybertruck's Impressive Acceleration Caught On Video InsideEVs Watch Tesla Cybertruck prototype accelerate like a sports car in new sighting Electrek Tesla (TSLA) shows strength amid impending Made-in-China Model 3 deliveries, Cybertruck sightings Tesla…Elon Musk's mother tweeted a picture from 1995 of Musk fixing an old busted up car. Musk tweeted back saying he used parts from a junkyard to repair the car, and in the photo he's fixing a broken window. ""The circle is complete,"" he added, referring back to t…Filed under: Green, Plants/Manufacturing, Tesla, Electric, sedan Tesla plans to build 500,000 electric vehicles a year at its new factory on the outskirts of Berlin, Germany's Bild newspaper reported on Wednesday. Last month, Tesla Chief Executive Elon Musk a…Plus.ai says it hauled a trailer full of butter 2,800 miles from California to PennsylvaniaMusk has got into spats and even long-running feuds with an eclectic bunch of people, often over his preferred medium of Twitter.“No other” electric car comes close to matching what the Tesla Inc. Model 3 offers for under $40,000, Edmunds.com says. Other top vehicles named by Edmunds on Wednesday included the Honda Accord as the best sedan and the Fiat Chrysler Ram as best pickup truck.The legacy automaker known for laying the stepping stones used by all automakers today…Apple's high-end computer monitor, meant to pair with the Mac Pro, promises beautiful images -- after special treatment."
2019-12-11,"EPA says the Porsche Taycan Turbo will get just 201 miles on a full batteryPorsche Taycan Turbo given low rating by EPA due to electricity usagePorsche Taycan already has 30,000 pre-orders. How does that compare to Tesla?Porsche Taycan Turbo gets woefully low EPA mile rangeTesla has reportedly lost its top lawyer for the third time in the past year (TSLA)See the magic of a Tesla ValveInside Tesla's overhaul plan for its sales and delivery teams to solve one of its toughest customer challenges (TSLA)Elon Musk's mother unearthed a 1995 photo of him fixing a car window, and he joked he's come 'full circle' with CybertruckTesla wants to produce 500,000 cars per year at German plantPlus.ai's autonomous lorry 'crosses US in three days'","It’s a much more conservative estimate than the 280 miles Porsche had previously promoted with the Taycan Turbo. And while it’s maybe a little too conservative of an estimate, it’s not going to help Porsche position its first EV against competition like Tesla.The EPA says the Porsche Taycan Turbo has just 201 miles of range, compared to the Tesla Model 3's 310 miles. Read more... More about Tech, Transportation, Mashable Video, Porsche Taycan Turbo, and Epa RatingThe year is 2012. Elon Musk has yet to call anyone a "" pedo guy "" or drag the SEC on Twitter. There's no Cybertruck with cracked windows, and no overly ambitious promises of a $35,000 electric car. Instead, fledgling electric vehicle company Tesla is just sta…When Porsche unveiled its electric supercar, the Taycan, the company said the Turbo S variant would have approximately 280 miles of range, with the ""regular"" Turbo trailing close behind with 260 miles of range. But now the official EPA rating is in, and the n…Tesla 's general counsel, Jonathan Chang, has left the company, Bloomberg 's Dana Hull reported. Chang's departure marks the third time a top lawyer at Tesla has left the electric-car maker in the past year. Tesla is known for its high rate of executive turno…In 1920, the great Nikola Tesla patented this ingenious valve that allows fluid or gas to flow in one direction but not the other. And it does it based entirely on its geometry without any moving parts. Here is the US patent, number 1,329,559. Read the restTesla has begun the process of merging the roles of its sales and delivery employees, four current and former employees told Business Insider. Announced internally in October, the initiative, called One Motion, is designed to give each customer a single point…Elon Musk's mother tweeted a picture from 1995 of Musk fixing an old busted up car. Musk tweeted back saying he used parts from a junkyard to repair the car, and in the photo he's fixing a broken window. ""The circle is complete,"" he added, referring back to t…Filed under: Green, Plants/Manufacturing, Tesla, Electric, sedan Tesla plans to build 500,000 electric vehicles a year at its new factory on the outskirts of Berlin, Germany's Bild newspaper reported on Wednesday. Last month, Tesla Chief Executive Elon Musk a…Plus.ai says it hauled a trailer full of butter 2,800 miles from California to Pennsylvania"
2019-12-12,"Porsche Taycan Turbo given low rating by EPA due to electricity usageExclusive: U.S. agency probes 12th Tesla crash tied to possible Autopilot usePorsche Taycan Turbo gets woefully low EPA mile rangeTesla updates Model 3 prices as electric car tax credits expire - RoadshowTesla has reportedly lost its top lawyer for the third time in the past year (TSLA)See the magic of a Tesla ValveInside Tesla's overhaul plan for its sales and delivery teams to solve one of its toughest customer challenges (TSLA)Tesla Cybertruck will likely get medium-duty truck classification like Ford Super Duty and othersMan Dies in Queens After Being Pinned Between 2 Parked Cars, One of Which Was Started RemotelyElon Musk's mom shares gawky photo of him fixing car in 1995 - CNET","The EPA says the Porsche Taycan Turbo has just 201 miles of range, compared to the Tesla Model 3's 310 miles. Read more... More about Tech, Transportation, Mashable Video, Porsche Taycan Turbo, and Epa RatingThe U.S. auto safety agency said Friday it will investigate a 12th Tesla crash that may be tied to the vehicle's advanced Autopilot driver assistance system after a Tesla Model 3 rear-ended a parked police car in Connecticut earlier this week.When Porsche unveiled its electric supercar, the Taycan, the company said the Turbo S variant would have approximately 280 miles of range, with the ""regular"" Turbo trailing close behind with 260 miles of range. But now the official EPA rating is in, and the n…It's one last hurrah for tax credits on any Tesla vehicle.Tesla 's general counsel, Jonathan Chang, has left the company, Bloomberg 's Dana Hull reported. Chang's departure marks the third time a top lawyer at Tesla has left the electric-car maker in the past year. Tesla is known for its high rate of executive turno…In 1920, the great Nikola Tesla patented this ingenious valve that allows fluid or gas to flow in one direction but not the other. And it does it based entirely on its geometry without any moving parts. Here is the US patent, number 1,329,559. Read the restTesla has begun the process of merging the roles of its sales and delivery employees, four current and former employees told Business Insider. Announced internally in October, the initiative, called One Motion, is designed to give each customer a single point…Filed under: Government/Legal, Green, Tesla, Truck, Electric Continue reading Tesla Cybertruck will likely get medium-duty truck classification like Ford Super Duty and others Tesla Cybertruck will likely get medium-duty truck classification like Ford Super D…A pedestrian in New York’s Queens borough was reportedly crushed to death between two parked cars after a 2002 Lexus’s remote engine ignition system was activated, causing the vehicle to lurch forward, Streetsblog reported on Wednesday. Read more...That cybertruck smashup wasn't the first time the Tesla CEO was faced with a busted window."
